{
  "algorithm": {
    "version": "git:abc123"
  },
  "budget": {
    "allocated": {
      "externalCalls": 50,
      "timeMs": 1500,
      "tokens": 2000
    },
    "children": [],
    "consumed": {
      "externalCalls": 3,
      "timeMs": 108,
      "tokens": 812
    },
    "remaining": {
      "externalCalls": 47,
      "timeMs": 1392,
      "tokens": 1188
    },
    "scope": "pipeline",
    "termination": {
      "code": "ok"
    }
  },
  "config": {
    "configHash": "sha256:0000000000000000000000000000000000000000000000000000000000000000",
    "configId": "cfg_01HZDEMO",
    "profileId": "prod@4"
  },
  "contracts": {
    "job.envelope.v1": "1.0.0",
    "pipeline.result.v1": "1.0.0",
    "run.manifest.v1": "1.0.0"
  },
  "correlation": {
    "requestId": "req_abc",
    "traceId": "trace_xyz"
  },
  "createdAt": "2026-01-23T10:00:00Z",
  "determinism": {
    "concurrency": {
      "workers": 4
    },
    "seed": 123456,
    "tier": "tier1"
  },
  "diagnostics": {
    "codes": [
      "run.succeeded"
    ],
    "counters": {},
    "kv": {},
    "notes": []
  },
  "inputRef": {
    "inputHash": "sha256:1111111111111111111111111111111111111111111111111111111111111111",
    "rawInputId": "s3://bucket/raw/01HZDEMO",
    "snapshotId": "snap_01HZDEMO"
  },
  "pipeline": {
    "id": "summarize.v2"
  },
  "runId": "2026-01-23T10:00:00Z/abcd",
  "schemaVersion": "1.0.0",
  "sideEffectsMode": "dryRun",
  "stageSummaries": [
    {
      "codes": [
        "ok"
      ],
      "stageId": "retrieve",
      "status": "ok",
      "timeMs": 31
    },
    {
      "codes": [
        "ok"
      ],
      "stageId": "llm",
      "status": "ok",
      "timeMs": 77
    }
  ]
}
